{
  "schemaVersion": "bo.model-observation.v1",
  "eventId": "evt_ddc1392c873146c4bf25e488",
  "producerId": "boagents",
  "product": "BOAgents",
  "installationId": "local-installation",
  "tenantRef": "tenant-fixture",
  "observedAt": "2026-09-24T09:45:01.542Z",
  "routing": {
    "correlationId": "turn-fixture-002",
    "policyVersion": "pol_fixture02",
    "catalogVersion": "cat_v3",
    "taskKind": "specialist",
    "metBar": false,
    "reasons": [
      "MODEL_DISABLED",
      "QUALITY_BAR_UNMET"
    ],
    "actualRoute": {
      "provider": "anthropic",
      "modelId": "claude-fixture-a",
      "modelVersion": "2026-09-01"
    },
    "costEstimate": {
      "amount": "0.008100",
      "currency": "USD",
      "validUntil": "2027-12-31"
    },
    "measuredUsage": {
      "inputTokens": 1200,
      "outputTokens": 300,
      "requests": 1
    }
  }
}
